{
  "$schema": "../../../../schemas/webcam.schema.json",
  "country_code": "kr",
  "region_slug": "gangwon",
  "place_slug": "oak-valley",
  "webcams": [
    {
      "label": "Snow Park Roof",
      "url": "https://cctv-oak9.ktcdn.co.kr/cctv/ch2.stream/chunklist.m3u8",
      "type": "stream",
      "label_i18n": {
        "ko": "스노우파크 옥탑",
        "en": "Snow Park Roof",
        "ja": "スノーパーク 옥トップ"
      }
    },
    {
      "label": "I Slope",
      "url": "https://cctv-oak9.ktcdn.co.kr/cctv/ch9.stream/chunklist.m3u8",
      "type": "stream",
      "label_i18n": {
        "ko": "I 슬로프",
        "en": "I Slope",
        "ja": "I スロープ"
      }
    },
    {
      "label": "G Slope",
      "url": "https://cctv-oak9.ktcdn.co.kr/cctv/ch7.stream/chunklist.m3u8",
      "type": "stream",
      "label_i18n": {
        "ko": "G 슬로프",
        "en": "G Slope",
        "ja": "G スロープ"
      }
    },
    {
      "label": "F Slope",
      "url": "https://cctv-oak9.ktcdn.co.kr/cctv/ch6.stream/chunklist.m3u8",
      "type": "stream",
      "label_i18n": {
        "ko": "F 슬로프",
        "en": "F Slope",
        "ja": "F スロープ"
      }
    },
    {
      "label": "Flower Lift Unloading Area",
      "url": "https://cctv-oak9.ktcdn.co.kr/cctv/ch5.stream/chunklist.m3u8",
      "type": "stream",
      "label_i18n": {
        "ko": "플라워리프트 하차장",
        "en": "Flower Lift Unloading Area",
        "ja": "Flower リフト Unloading Area"
      }
    }
  ]
}
