{
  "$schema": "../../../../schemas/webcam.schema.json",
  "country_code": "kr",
  "region_slug": "gyeonggi",
  "place_slug": "jisan",
  "webcams": [
    {
      "label": "Lemon",
      "url": "https://ant.livecity.co.kr:5443/jisancam/streams/jisan1.m3u8",
      "type": "stream",
      "refresh_interval_ms": 60000,
      "label_i18n": {
        "ko": "레몬",
        "en": "Lemon",
        "ja": "Lemon"
      }
    },
    {
      "label": "Orange/New Orange",
      "url": "https://ant.livecity.co.kr:5443/jisancam/streams/jisan2.m3u8",
      "type": "stream",
      "refresh_interval_ms": 60000,
      "label_i18n": {
        "ko": "오렌지/뉴오렌지",
        "en": "Orange/New Orange",
        "ja": "オレンジ／New オレンジ"
      }
    },
    {
      "label": "Slope 5/6",
      "url": "https://ant.livecity.co.kr:5443/jisancam/streams/jisan3.m3u8",
      "type": "stream",
      "refresh_interval_ms": 60000,
      "label_i18n": {
        "ko": "5번/6번 슬로프",
        "en": "Slope 0.8333333333333334",
        "ja": "コース 5／6"
      }
    },
    {
      "label": "Blue",
      "url": "https://ant.livecity.co.kr:5443/jisancam/streams/jisan4.m3u8",
      "type": "stream",
      "refresh_interval_ms": 60000,
      "label_i18n": {
        "ko": "블루",
        "en": "Blue",
        "ja": "ブルー"
      }
    },
    {
      "label": "Silver",
      "url": "https://ant.livecity.co.kr:5443/jisancam/streams/jisan5.m3u8",
      "type": "stream",
      "refresh_interval_ms": 60000,
      "label_i18n": {
        "ko": "실버",
        "en": "Silver",
        "ja": "シルバー"
      }
    }
  ]
}
