{
  "$schema": "../../../../schemas/webcam.schema.json",
  "country_code": "kr",
  "region_slug": "gangwon",
  "place_slug": "yongpyong",
  "webcams": [
    {
      "label": "Yellow",
      "url": "https://live.yongpyong.co.kr/cam11/index.m3u8",
      "type": "stream",
      "label_i18n": {
        "ko": "옐로우 슬로프",
        "en": "Yellow Slope",
        "ja": "イエロー スロープ"
      }
    },
    {
      "label": "Base Overview / Red Slope",
      "url": "https://live.yongpyong.co.kr/cam08/index.m3u8",
      "type": "stream",
      "label_i18n": {
        "ko": "베이스 전경 / 레드 슬로프",
        "en": "Base Overview / Red Slope",
        "ja": "ベース 全景 / レッド スロープ"
      }
    },
    {
      "label": "Balwangsan Sky Walk",
      "url": "https://live.yongpyong.co.kr/cam01/index.m3u8",
      "type": "stream",
      "label_i18n": {
        "ko": "발왕산 氣 스카이워크",
        "en": "Balwangsan Sky Walk",
        "ja": "バルワンサン スカイウォーク"
      }
    },
    {
      "label": "Balwangsan Forest Path",
      "url": "https://live.yongpyong.co.kr/cam02/index.m3u8",
      "type": "stream",
      "label_i18n": {
        "ko": "발왕산 천년주목숲길",
        "en": "Balwangsan Yew Forest Trail",
        "ja": "バルワンサン イチイの森の道"
      }
    },
    {
      "label": "Yongpyong Entrance",
      "url": "https://live.yongpyong.co.kr/cam05/index.m3u8",
      "type": "stream",
      "label_i18n": {
        "ko": "모나용평 진입로",
        "en": "Mona Yongpyong Entrance",
        "ja": "モナ ヨンピョン 入口"
      }
    }
  ]
}
