{
  "$schema": "../../../schemas/webcam.schema.json",
  "country_code": "kr",
  "region_slug": "gyeongsangnam-do",
  "place_slug": "eden-valley",
  "webcams": [
    {
      "label": "Basic",
      "url": "https://rtsp.me/embed/2kTsKt35/",
      "type": "image",
      "refresh_interval_ms": 60000,
      "label_i18n": {
        "ko": "베이직",
        "en": "Basic",
        "ja": "Basic"
      }
    },
    {
      "label": "Slope Plaza",
      "url": "https://rtsp.me/embed/ry9aTdQh",
      "type": "image",
      "refresh_interval_ms": 60000,
      "label_i18n": {
        "ko": "슬로프 광장",
        "en": "Slope Plaza",
        "ja": "コース 広場"
      }
    }
  ]
}
