{
  "$schema": "../../../../schemas/webcam.schema.json",
  "country_code": "ch",
  "region_slug": "bernese-oberland",
  "place_slug": "eiger-north-face",
  "webcams": [
    {
      "label": "Summit North View",
      "url": "https://webcam-provider.com/eiger/summit.jpg",
      "type": "image",
      "refresh_interval_ms": 60000
    },
    {
      "label": "Glacier Base",
      "url": "https://webcam-provider.com/eiger/base.jpg",
      "type": "image",
      "refresh_interval_ms": 120000
    }
  ]
}
